No,Rank,Title,Url,Root Domain,Est. Visits,Social Shares,Domain Authority
1,1,Full Stack Java developer - Java + JSP + Restful WS + Spring ...,http://www.udemy.com/course/full-stack-java-developer-java/,udemy.com,0,0,90
2,2,Full Stack Web Development Masters Program - Edureka,http://www.edureka.co/masters-program/full-stack-developer-training,edureka.co,0,1865,76
3,3,Full Stack Developer Course | Java Developer Certification ...,http://www.simplilearn.com/java-full-stack-developer-certification-training-course,simplilearn.com,0,0,85
4,4,full stack developer - ABC for Technology Training,http://abctechtraining.com/course/full-stack-developer-course,abctechtraining.com,0,0,8
5,5,Full Stack Development Course Training - Best Full Stack Web ...,http://nareshit.in/full-stack-development-course/,nareshit.in,0,105,43
6,6,Full Stack Development | edX,http://www.edx.org/learn/full-stack-development,edx.org,0,0,90
7,7,Full Stack Web Development Courses | Coursera,http://www.coursera.org/courses?query=full stack web development,coursera.org,0,0,90
8,8,"Full Stack Development course, Full Stack web ... - Great Learning",http://www.greatlearning.in/full-stack-developer-course,greatlearning.in,0,0,63
9,9,Full Stack Development | SEED Infotech Ltd,http://www.seedinfotech.com/full-stack-development/,seedinfotech.com,0,31,48
10,10,Java Full stack Developer Training: Online Java Courses Delhi Noida,http://www.exuberantsolutions.com/java-full-stack-developer-training.htm,exuberantsolutions.com,0,35,36
